{"checkpointed_at":"2026-10-07T04:45:13.625Z","execution_manifest_sha256":"03586029b4faa11c0f4c14cc7ea0ad291b0afa25036c91639f97d02a35979a54","journal_path":"coordination/coordination-journal.jsonl","last_event_id":"d61f8296-54c9-4e88-bf47-4722cecfa6a3","last_source_sequence":12,"prefix_byte_count":9057,"prefix_sha256":"813f7339107067f199838b01859f6099e4dcce61f98f611ab158123d9dabd6bc","record_type":"coordination_prefix_checkpoint","schema_version":1,"transport_probe_id":"adfca539-508f-4a51-9a98-e1dcf8cec84a"}
